<?xml version="1.0" encoding="UTF-8" standalone="no"?>
<!DOCTYPE SuperCell SYSTEM "../../MembraneComputing.dtd"[
	<!-- Objects -->
	<!ATTLIST a multiplicity CDATA #REQUIRED>
	<!ATTLIST c multiplicity CDATA #REQUIRED>
	]>

<!-- CoopSys02ex343_2
-->

<SuperCell>
	<CompletionDetector/>
	<!-- mu=[1[2]2[3]3]1 -->
	<Environment>
		<Objects>
		</Objects>
	</Environment>
    <Membrane roleName="1">
		<Region>
			<Objects>
			</Objects>
			<RuleSet roleName="R1">
				<R1r1/>
				<R1r2><attribute name="priority" value="99"/></R1r2>
			</RuleSet>
		</Region>
		<Membrane roleName="2">
			<Region>
				<Objects>
					<a multiplicity="52"/> <!-- multiplicity value is "n" -->
					<c multiplicity="13"/> <!-- multiplicity value is "k" -->
					<d/>
				</Objects>
				<RuleSet roleName="R2">
					<R2r1/>
					<R2r2/>
					<R2r3><attribute name="priority" value="99"/></R2r3>
				</RuleSet>
			</Region>
		</Membrane>
		<Membrane roleName="3">
			<Region>
				<Objects>
				</Objects>
				<RuleSet roleName="R3">
				</RuleSet>
			</Region>
		</Membrane>
	</Membrane>
</SuperCell>
